{
  "schema_version": 2,
  "commit": "ccccccc",
  "branch": "pr-real-regression",
  "z42vm_version": "0.5.0",
  "timestamp": "2026-08-24T02:00:00Z",
  "benchmarks": [
    {
      "name": "01_fibonacci", "tier": "z42-e2e", "metric": "time",
      "value": 130.0, "unit": "ms", "ci_lower": 124.0, "ci_upper": 136.0, "samples": 10,
      "profile": {
        "mode": { "tiers": ["interp", "jit"], "aot_pkgs": [] },
        "mode_label": "jit",
        "platform": { "os": "linux", "arch": "x64" },
        "caps": ["jit", "native-interop", "threads"]
      }
    },
    {
      "name": "02_math_loop", "tier": "z42-e2e", "metric": "time",
      "value": 50.0, "unit": "ms", "ci_lower": 48.0, "ci_upper": 52.0, "samples": 10,
      "profile": {
        "mode": { "tiers": ["interp", "jit"], "aot_pkgs": [] },
        "mode_label": "jit",
        "platform": { "os": "linux", "arch": "x64" },
        "caps": ["jit", "native-interop", "threads"]
      }
    }
  ]
}
